{
  "schema_version": "AGL_LITE_V1_2_1",
  "project_id": "AGL-LITE-EXAMPLE",
  "policy_version": "policy-v1.2.1",
  "created_at_utc": "2026-10-27T00:00:00Z",
  "task_id": "TASK-001",
  "task_type": "EXPLORATION",
  "status": "READY",
  "spec_hash": "aaaaaaaaaaaaaaaaaaaaaaaaaaaaaaaaaaaaaaaaaaaaaaaaaaaaaaaaaaaaaaaa",
  "dependencies": [],
  "acceptance_criteria": [
    "提供最小重放证据"
  ],
  "allowed_paths": [
    "experiments/TASK-001/"
  ],
  "attempt_epoch": 0,
  "risk": "R1"
}
